{
  "schemaVersion": "explainer-kit.author-result/v2",
  "artifactId": "execution-record",
  "content": {
    "markdown": "The feature shipped in five phases. The more useful record is what the\ndispatch workflow did while shipping it, because this project's subject matter\nand its execution method were the same thing.\n\n## Phase outcomes\n\n| Phase | Result | Fix iterations |\n| --- | --- | --- |\n| p01 | Passed re-review | 1 |\n| p02 | Passed re-review | 1 |\n| p03 | Blocked, then passed after authorized recovery | 0 |\n| p04 | Passed with no findings at any severity | 0 |\n| p05 | Final-review fixes, then clean re-review | 1 |\n\nThree of five phases needed a fix iteration or a recovery. That is the ordinary\nshape of the loop rather than a warning sign, and the phases that needed nothing\nwere the smaller ones.\n\n## The blocked phase\n\nPhase 3 is the interesting one. The root dispatch carried stale scope boundaries\nthat contradicted the canonical `plan.md`. The accepted implementer noticed the\nconflict, made no changes, and left its worktree clean at the base commit.\n\n```timeline\n2026-07-23 — p03 dispatched with stale boundaries\n2026-07-23 — Implementer declines to edit; worktree left clean\n2026-07-23 — Operator authorizes a fresh attempt from canonical plan\n2026-07-23 — p03 passes review; docs-link failures confirmed pre-existing\n```\n\nThe recovery required explicit operator authorization rather than an automatic\nretry, which is the same terminality rule the shipped feature enforces: a\nfailure after acceptance is an outcome to record, not a trigger to relaunch on a\nsubstitute. The workflow applied to itself the constraint it was implementing.\n\n> [!IMPORTANT]\n> The implementer making no changes is the desirable behavior. An agent that\n> reconciled the contradiction on its own would have silently produced work\n> against boundaries nobody approved.\n\n## Where verification caught things\n\n| Stage | What it found |\n| --- | --- |\n| Phase 1 | Autonomy-inventory and reviewer-version contract drift, directly caused by the change |\n| Phase 3 merge | Duplicate bootstrap-sync manifest conflict; two reviewed commits cherry-picked |\n| Final verification | The new legacy-record fixture added a prompt site to the autonomy inventory |\n\nThe last one is worth naming precisely. A fixture added to prove backward\ncompatibility was itself counted as a prompt site by the autonomy inventory.\nMapping it as non-gating schema evidence resolved it — the fixture was evidence\nabout the schema, not a prompt the system would execute.\n\n## Gate results\n\nThe plan gate blocked once with one Important and one Medium finding, and the\nproject proceeded under an explicit operator override after those were fixed.\nEvery review after that was clean: independent phase reviews, the final\nlifecycle review, and two cross-family exit gates at\n`critical:0, important:0, medium:0, minor:0`.\n\nFinal verification covered workspace tests, lint, type-check, package and docs\nbuilds, release validation, registry checks, local docs-link crawling, and\nprovider-sync dry runs. The work merged as [PR #172](https://github.com/voxmedia/open-agent-toolkit/pull/172): 93 commits\nacross 128 files, +6,518/−261.\n"
  },
  "provenance": {
    "authorId": "cursor-agent",
    "generatedAt": "2026-07-27T14:04:03.265Z",
    "method": "interactive-session-authoring",
    "trust": "self-asserted"
  }
}
