{
  "schemaVersion": "explainer-kit.author-result/v2",
  "artifactId": "project-recap",
  "content": {
    "markdown": "Explainer Kit stopped producing explainers worth reading. This project\nrebuilt how they are authored.\n\n> [!NOTE]\n> This recap was generated by the redesigned kit, running against its own\n> project artifacts. It is both the deliverable and the first real test.\n\n## Original request\n\nA recap the kit produced for an unrelated project was, in the reviewer's words,\n\"basic AF.\" The kit had passed every gate it owned while shipping a page nobody\nwanted to read.\n\nThe request was to find out why and fix the cause, not the symptom. Three\nconstraints shaped the work:\n\n- Recaps can be more structured than decks, but structure must come from\n  guidance rather than rigid schemas.\n- Decks and explainers need genuine artistic freedom.\n- Runs should be recognizably consistent without being replicas. Two runs of the\n  same project may legitimately differ.\n\nSuccess meant a kit whose output varies with its content instead of with its\ntemplate.\n\n## Key agent decisions\n\n| Decision | Reason | Consequence |\n| --- | --- | --- |\n| Two authoring paths per artifact | One mode cannot serve both a structured recap and an expressive deck | Narrative artifacts render deterministically; artistic ones are composed by the agent |\n| Prose carries quality, schemas carry identity | Editorial expectations encoded as schema became shape-checking, which is not quality | Richness is verified by reading output, not by assertion |\n| Guidelines degrade to warnings | A floor miss is an editorial signal, not a corruption | Safety and provenance stay hard errors; everything else reports |\n| Recipe policy owns expansion | If authors pick their own freedom level, every author picks the freest | Cohesion survives without forcing identical output |\n| No content generator ships | Bundling one would recreate the rigidity being removed | The calling agent is the author, through a caller-owned seam |\n\nThe last decision is the load-bearing one. The kit does not write; it renders,\nvalidates, and records. A caller that supplies a weak author still gets weak\noutput, and that was accepted deliberately.\n\n## As-built architecture\n\nRecipe policy decides how each artifact is authored. The author proposes what\nthe content warrants. Neither side chooses both.\n\n```diagram\ngraph LR\nAuthor[Author seam] --> Render[Render]\nRender --> Checks[Safety and guidelines]\nChecks --> Approve[Approval]\nApprove --> Manifest[Manifest]\n```\n\nThat fence is the run pipeline, and it is deliberately linear: the inline\nrenderer lays nodes out in sequence, so a chain is the shape it represents\nfaithfully. The *branching* form — where the seam fans out to two renderers and\nthey converge again — is a composed diagram on the artistic path, linked from\nthis page. Choosing the right path per artifact is the redesign in miniature.\n\nThe two paths differ in what the agent hands over:\n\n| | Narrative path | Artistic path |\n| --- | --- | --- |\n| Author returns | Markdown | HTML |\n| Structure from | Deterministic renderer | Agent composition |\n| Interactivity | None | Hash-pinned shell scripts only |\n| Typical use | Recaps, deep dives | Decks, diagrams |\n\nMarkdown is the renderer's actual input, not a provenance record of something\nalready rendered. Tables, alert callouts, fenced timelines, and fenced diagrams\nsurvive as structure.\n\nSafety is positional rather than advisory. Artistic artifacts may be composed\nfreely but may only carry scripts whose hashes are pinned, so an agent cannot\nintroduce behavior while composing layout.\n\n## Implementation record\n\n| Component | Notable change | Reference |\n| --- | --- | --- |\n| Recipe contract | `recipe/v2` beside v1 via a dual-version loader, with finite expansion caps per recipe and per type | [PR #179](https://github.com/voxmedia/open-agent-toolkit/pull/179) |\n| Narrative renderer | Markdown promoted to renderer input; tables, callouts, timelines, and a Mermaid diagram subset | [PR #179](https://github.com/voxmedia/open-agent-toolkit/pull/179) |\n| Artistic composer | Agent-composed HTML validated against hash-pinned core shell scripts | [DR-260726-core-shell-scripts-are-hash](https://github.com/voxmedia/open-agent-toolkit/blob/tkstang/personal-explainer-kit/.oat/repo/reference/decisions/DR-260726-core-shell-scripts-are-hash.md) |\n| Guideline checker | Floor misses emit warnings; safety and provenance remain errors | [PR #179](https://github.com/voxmedia/open-agent-toolkit/pull/179) |\n| Approval | Moved after render and QA, accepted set persisted in `content-approval/v2` | [PR #179](https://github.com/voxmedia/open-agent-toolkit/pull/179) |\n| Provenance | Identity and method bind through trusted caller config; core stamps time | [PR #179](https://github.com/voxmedia/open-agent-toolkit/pull/179) |\n\n```timeline\n2026-07-19 — Redesign brainstorm converges on two authoring paths\n2026-07-25 — Plan accepted by operator after six review cycles\n2026-07-26 — Eight phases land, then ten review fixes\n2026-07-26 — Render QA cut to opt-in; project shipped\n```\n\nThe work ran as 8 phases and 20 planned tasks, plus three correctives, a\n10-task revision phase, and a final scope reduction. Phases 2, 3, and 4 ran in\nparallel on disjoint write sets.\n\n## Validation evidence\n\n| Check | Command | Result |\n| --- | --- | --- |\n| Core suite | `node --test .agents/skills/explainer-kit/tests/*.test.mjs` | 224 pass |\n| Adapter suite | `node --test .agents/skills/oat-explainer-kit/tests/*.test.mjs` | 59 pass |\n| Smoke | `node --test tools/smoke/**/*.test.mjs` | 129 pass |\n| Release tooling | `node --test tools/release/*.test.mjs` | 44 pass, 1 environment-gated skip |\n| Release gate | `pnpm release:validate` | pass, including real-Chromium visual checks |\n| Anti-regression | `node --test .agents/skills/explainer-kit/tests/e2e-recap.test.mjs` | pass, and verified non-vacuous |\n\nThe anti-regression fixture was checked by breaking the table renderer on\npurpose: 6 of its 8 assertions failed, confirming it measures rendering rather\nthan restating it.\n\n> [!IMPORTANT]\n> Automated tests are not sufficient here, and this run proved it. After the\n> suite above was green, three defects were found by opening the page in a\n> browser: section numerals rendering as body text, diagram labels downscaled to\n> 8px, and wrapped list items splitting into separate lists. The linked\n> process deep-dive records what that implies.\n\n## Outcome\n\nWorking now: content-driven artifact sets within policy caps, Markdown that\nrenders as structure, an artistic path that cannot smuggle in behavior,\nwarnings that inform instead of blocking, and resumable approval that survives\na rejected draft.\n\nNot shipped: automatic render QA. It was built during the revision phase and\nthen removed. It had grown to own a browser dependency and a large share of the\ntest surface, and the published CLI did not ship the driver it imported. The\nagent generating an explainer reviews it in a browser instead.\n\nThe next reader should run the kit on a real project and judge the output by\nreading it. That is the only test that matters for this change, and it is the\ntest the redesign was built to pass.\n"
  },
  "provenance": {
    "authorId": "cursor-agent",
    "generatedAt": "2026-07-27T04:05:11.693Z",
    "method": "interactive-session-authoring",
    "trust": "self-asserted"
  },
  "proposedArtifacts": [
    {
      "id": "authoring-paths",
      "profileId": "supporting-diagram",
      "rationale": "The two-path model is the load-bearing idea and it branches, which the inline fenced-diagram renderer cannot lay out."
    },
    {
      "id": "approval-sequence",
      "profileId": "supporting-diagram",
      "rationale": "Approval moved after render and QA and carries a rejection loop back to render; a cyclic flow needs a composed diagram."
    },
    {
      "id": "review-loop",
      "profileId": "deep-dive",
      "rationale": "The review loop consumed more effort than the implementation and its numbers do not fit the hub without crowding out the architecture."
    },
    {
      "id": "walkthrough",
      "profileId": "walkthrough-deck",
      "rationale": "A six-frame walkthrough gives a reviewer the request, the change, and the evidence without reading the full hub."
    }
  ]
}
