{
  "schemaVersion": "explainer-kit.author-result/v2",
  "artifactId": "review-loop",
  "content": {
    "markdown": "The redesign itself took eight phases. Reviewing it took longer, and the\nloop did not converge on its own — it was ended by decision. This page records\nwhat the review cycles actually cost, because the hub reports the outcome\nwithout the shape of the effort.\n\n> [!NOTE]\n> This is a process record, not an architecture page. The mechanism it describes\n> is the review loop, not the kit.\n\n## What the cycles cost\n\n| Stage | Cycles | Outcome |\n| --- | --- | --- |\n| Plan artifact review | 6 | Accepted by operator, never gate-passed |\n| Final code review | 1 | 10 findings, all verified real |\n| Re-review of the 11 fix commits | 1 | `block` with 8 further findings |\n| Disposition of those 8 | 0 | 2 fixed, 2 dissolved, 4 dropped |\n\nThe plan needed six gate cycles before implementation began. Each cycle\nsurfaced real defects, which is the argument for running them. But cycles four\nthrough six increasingly produced *design* questions rather than plan defects —\nthe gate was being asked to settle interface decisions that only code contact\ncould settle. That is what motivated resolving nine decisions (D1 through D9)\nexplicitly and then treating the plan as operator-accepted.\n\n## Where the loop stopped paying\n\nThe final code review returned ten findings and every one was reproducible.\nThat review earned its cost. The re-review of the resulting eleven fix commits\nreturned eight more, and the disposition tells the story:\n\n- **Two were fixed** — stale render and QA warnings surviving a corrected\n  resume, and a lifecycle artifact that misdescribed a commit.\n- **Two dissolved** without code changes when automatic Render QA was cut. The\n  unshipped browser driver and the unrestricted probe-module import existed\n  only to serve a subsystem that was removed.\n- **Four were dropped** rather than backlogged. Two HTML-safety gaps are\n  unreachable while artifacts are composed from hash-pinned shells; one anchor\n  collision needs an author to use `overview`, `introduction`, and `lead`\n  simultaneously; one warning is already re-added by the pipeline.\n\nHalf of the second-round findings were either self-resolving or not worth\nacting on. That ratio is the signal: the loop had stopped finding defects that\nmattered and started finding defects that merely existed.\n\n## The counter-evidence\n\nThe strongest argument against more review cycles is what happened *after* they\nstopped. The kit passed 221 core tests and a full release gate, and then three\ndefects were found within seconds of opening the output in a browser:\n\n| Defect | Detected by | Missed by |\n| --- | --- | --- |\n| Section numerals rendered as 16px black body text | Looking at the page | 221 tests, release gate |\n| Diagram labels downscaled to 8px | Measuring the SVG | 221 tests, release gate |\n| Wrapped list items split into separate lists | Looking at the page | 221 tests, release gate |\n\nNone of these were subtle. All three were invisible to the entire automated\nsuite because the suite asserted structure while the defects were in\npresentation and in a parser path no fixture exercised with wrapped input.\n\n> [!IMPORTANT]\n> More review cycles would not have found these. Rendering the output and\n> reading it did, immediately. That is why the shipped decision is that the\n> agent generating an explainer reviews it in a browser.\n\n## What this implies for the next change\n\nTwo practices earned their place and one did not:\n\n- **Revert-verification earned it.** Every probe fix was verified by breaking\n  the thing it fixed and confirming the test failed. The anti-regression\n  fixture was checked the same way — breaking the table renderer failed 6 of 8\n  assertions.\n- **Rendered review earned it.** Three real defects, zero automation.\n- **Additional adversarial passes did not.** The second round produced a 2-fixed\n  out-of-8 yield.\n\nThe full record lives in [PR #179](https://github.com/voxmedia/open-agent-toolkit/pull/179).\n"
  },
  "provenance": {
    "authorId": "cursor-agent",
    "generatedAt": "2026-07-27T19:34:59.419Z",
    "method": "interactive-session-authoring",
    "trust": "self-asserted"
  }
}
